Computer,250,"A device which is designed or permits the end user to install
        software applications.",A4Tech,21|Warranty|23|Installation|,"2023-04-05 00:00:00"
Keyboard,23,"Is a hand-held pointing device that detects two-dimensional 
        motion relative to a surface.",Xiaomi,22|Delivery|,"2023-05-02 00:00:00"
Mouse,69,"Is a small device that a computer user pushes across a desk surface in order to point to a place on a display screen and to select one or more actions to take from that position",Apple,21|Warranty|23|Installation|24|Configuration|,"2023-05-01 00:00:00"
Carpet,233,"Some description",Intel,21|Warranty|23|Installation|,"2023-05-20 00:00:00"
Laptop,123,"A laptop, sometimes called a notebook computer by manufacturers, is a battery- or AC-powered personal computer (PC) smaller than a briefcase",Intel,21|Warranty|22|Delivery|23|Installation|24|Configuration|,"2023-05-22 00:00:00"
Camera,25,"A device that consists of a lightproof chamber with an aperture fitted with a lens and a shutter through which the image of an object is projected onto a surface for recording.",Xiaomi,21|Warranty|23|Installation|,"2023-05-22 00:00:00"
Headphones,45,"A device with parts that cover each ear through which you can listen to something, such as music, without other people hearing.",Apple,21|Warranty|22|Delivery|,"2023-05-22 00:00:00"
